{
  "schemaVersion": 1,
  "entityId": "label_000060",
  "entityType": "organization",
  "sources": [
    {
      "url": "https://moodyz.com/works/list/label/10142",
      "kind": "official",
      "title": "おっぱい祭り 該当作品",
      "accessedAt": "2026-09-04",
      "fields": [
        "names",
        "parentOrganizationId",
        "officialWebsite",
        "externalIds"
      ],
      "note": "官方 Label Index 与 Label 详情 URL 明确支持名称、所属 Maker 目录和 moodyz.label:10142 外部 ID；status 保守保持 unknown，不因页面当前可访问就推断 active。"
    }
  ]
}
