{
  "schemaVersion": 1,
  "entityId": "series_000030",
  "entityType": "series",
  "sources": [
    {
      "url": "https://madonna-av.com/works/list/series/1552",
      "kind": "official",
      "title": "特選 友達の母該当作品",
      "accessedAt": "2026-09-04",
      "fields": [
        "names",
        "makerId",
        "officialWebsite",
        "externalIds"
      ],
      "note": "0.4.4 Series Index Snapshot 中的候选经官方 Series 详情页人工复核后发布。URL 路径中的 1552 登记为 madonna.series 命名空间内的稳定外部 ID；未根据名称推断 Label 归属。"
    }
  ]
}
