{
  "schemaVersion": 1,
  "entityId": "maker_8532ca68-cad7-4ef5-a7ae-732bfc77dec2",
  "entityType": "organization",
  "sources": [
    {
      "url": "https://ja.wikipedia.org/wiki/%E3%82%A2%E3%82%A4%E3%83%87%E3%82%A2%E3%83%9D%E3%82%B1%E3%83%83%E3%83%88",
      "kind": "database",
      "title": "アイデアポケット - Wikipedia",
      "accessedAt": "2026-09-02",
      "fields": [
        "names"
      ],
      "note": "页面同时给出官方站点链接；本次抓取官方站点超时，因此未将未读页面伪装为已核验来源。"
    }
  ]
}
