{
  "schemaVersion": 1,
  "entityId": "work_000002",
  "entityType": "work",
  "sources": [
    {
      "url": "https://ja.wikipedia.org/wiki/%E3%82%A2%E3%82%A4%E3%83%87%E3%82%A2%E3%83%9D%E3%82%B1%E3%83%83%E3%83%88",
      "kind": "database",
      "title": "アイデアポケット - Wikipedia",
      "accessedAt": "2026-09-04",
      "fields": [
        "code",
        "titles",
        "personRelations",
        "makerId",
        "genreIds"
      ],
      "note": "Genre 仅映射日文原题明确列出的顔射、フェラ、野外、拘束、主観、コスプレ与ハメ撮り。"
    },
    {
      "url": "https://ja.wikipedia.org/wiki/%E6%A1%83%E4%B9%83%E6%9C%A8%E3%81%8B%E3%81%AA",
      "kind": "database",
      "title": "桃乃木かな - Wikipedia",
      "accessedAt": "2026-09-04",
      "fields": [
        "releaseDate"
      ]
    }
  ]
}
