{
  "schemaVersion": 1,
  "entityId": "label_55555555-5555-4555-8555-555555555555",
  "entityType": "organization",
  "sources": [
    {
      "url": "https://example.com/fictional/label_55555555-5555-4555-8555-555555555555",
      "kind": "other",
      "title": "Fictional example source",
      "accessedAt": "2026-09-02",
      "fields": ["names", "parentOrganizationId"],
      "note": "完全虚构，仅用于说明 Source Record 格式。"
    }
  ]
}
