{
  "schemaVersion": 1,
  "entityId": "person_000002",
  "entityType": "person",
  "sources": [
    {
      "url": "https://alive-pro.tokyo/model/mio_ishikawa",
      "kind": "agency",
      "accessedAt": "2026-09-04",
      "fields": [
        "names",
        "activityStatus",
        "careerEvents",
        "birthDate",
        "heightCm",
        "measurements",
        "agency",
        "bloodType"
      ],
      "note": "结合公开资料与用户提供的参考表核对；来源未明确支持的字段仍需后续逐字段复核。"
    }
  ]
}
