{
  "schemaVersion": 1,
  "entityId": "series_000117",
  "entityType": "series",
  "sources": [
    {
      "url": "https://s1s1s1.com/works/list/series/573",
      "kind": "official",
      "title": "おっぱい離れできないボク該当作品",
      "accessedAt": "2026-09-04",
      "fields": [
        "names",
        "makerId",
        "officialWebsite",
        "externalIds"
      ],
      "note": "0.4.9 Five-provider Coverage Balance Batch 的 partial Snapshot 候选经官方 Series 详情页人工复核后发布。URL 路径中的外部 ID 登记在对应 Provider *.series 命名空间；未根据名称或作品内容推断 Label 归属。"
    }
  ]
}
